{
  "schemaVersion": "0.1.0",
  "id": "pokemon.emerald.us-rev0-acquisition",
  "name": "Pokemon Emerald Rev 0 Acquisition",
  "type": "game",
  "version": "1.0.0",
  "description": "Provider-neutral Emerald Rev 0 addresses, Gen III decoding, source contract, fixtures, and mapping into Pokemon state.",
  "entrypoints": {
    "docs": "README.md",
    "main": "emerald-acquisition.lua",
    "schema": "schemas/emerald-us-rev0-source.schema.json",
    "mapping": "mappings/emerald-us-rev0-to-pokemon-overlay-state.mapping.json",
    "fixtures": "fixtures"
  },
  "compatibility": {
    "games": [
      {
        "name": "Pokemon Emerald (English retail Rev 0)",
        "romIds": ["AGB-BPEE", "CRC32:1F1C08FB", "SHA1:f3ae088181bf583e55daf962a92bb46f4f1d07b7"],
        "versions": ["0"]
      }
    ],
    "generations": [3]
  },
  "provides": {
    "sourceSnapshots": true,
    "normalizedStateMapping": true,
    "readOnly": true
  },
  "exports": {
    "sourceContract": {
      "id": "pokemon.emerald.us-rev0.acquisition",
      "version": "1.0.0"
    },
    "targetContract": {
      "id": "pokemon.overlay-state",
      "version": "0.1.0"
    }
  },
  "publicSafety": {
    "containsRoms": false,
    "containsBios": false,
    "containsSaves": false,
    "containsSecrets": false
  }
}
