{
  "schemaVersion": "0.1.0",
  "id": "example.data",
  "name": "Example Data Extension",
  "type": "data",
  "version": "0.1.0",
  "description": "Template for species, moves, encounters, trainers, and other data packs.",
  "compatibility": {
    "generations": [3],
    "games": [
      {
        "name": "Example Game",
        "versions": ["1.0.0"]
      }
    ]
  },
  "provides": {
    "species": true,
    "moves": true,
    "items": true,
    "learnsets": true,
    "tmCompatibility": true,
    "encounters": true,
    "trainerSets": true,
    "facilitySets": false
  },
  "publicSafety": {
    "containsRoms": false,
    "containsBios": false,
    "containsSaves": false,
    "containsSecrets": false
  }
}

