{
  "schemaVersion": "0.1.0",
  "id": "pokemon.gen3.mgba.emerald-us-rev0-acquisition",
  "name": "Pokemon Emerald Rev 0 mGBA Source Provider",
  "type": "emulator",
  "version": "0.2.0",
  "description": "Read-only mGBA Lua provider for a named, versioned Pokemon Emerald Rev 0 source snapshot.",
  "entrypoints": {
    "docs": "README.md",
    "main": "emerald-acquisition.lua",
    "schema": "schemas/emerald-us-rev0-source.schema.json",
    "fixtures": "fixtures"
  },
  "compatibility": {
    "emulators": [
      {
        "name": "mGBA",
        "versions": ["0.10.3"]
      }
    ],
    "games": [
      {
        "name": "Pokemon Emerald (English retail Rev 0)",
        "romIds": ["AGB-BPEE", "CRC32:1F1C08FB", "SHA1:f3ae088181bf583e55daf962a92bb46f4f1d07b7"],
        "versions": ["0"]
      }
    ],
    "generations": [3]
  },
  "provides": {
    "sourceSnapshots": true,
    "readOnly": true
  },
  "exports": {
    "sourceContract": {
      "id": "pokemon.emerald.us-rev0.mgba.acquisition",
      "version": "1.0.0"
    }
  },
  "publicSafety": {
    "containsRoms": false,
    "containsBios": false,
    "containsSaves": false,
    "containsSecrets": false
  }
}
